SKU,Nombre,Precio,Existencias,Costo,Proveedor,Status,Vencimiento,CategoriaPrincipal,Subcategoria,UnidadMedida
B37,Perfume Tom Ford Oud wood 100ml, 130.00,30.0, 110.00,VB,Active,,Cuidado personal,Perfumes,12
B36,Perfume Tom Ford Fabulous 100ml, 130.00,36.0, 110.00,VB,Active,,Cuidado personal,Perfumes,12
B35,Perfume Tom Ford Tuscan Leather 100ml, 130.00,10.0, 110.00,VB,Active,,Cuidado personal,Perfumes,12
B9,Perfume Aventus Creed 100ml, 142.00,78.0, 120.00,VB,Active,,Cuidado personal,Perfumes,12
G3135,Balsamo Labial Limon Orof, 12.00,557.0, 10.00,VB,Active,2028-08-01,Maquillaje,Labios,24
G3134,Balsamo Labial Arándano Orof, 12.00,172.0, 10.00,VB,Active,2028-08-01,Maquillaje,Labios,24
G3137,Balsamo Labial Sandia 24h Orof, 12.00,511.0, 10.00,VB,Active,2028-08-01,Maquillaje,Labios,24
G3136,Balsamo Labial Fresas 24h Orof, 12.00,370.0, 10.00,VB,Active,2028-08-01,Maquillaje,Labios,24
ST3361,"Base Liquida 36h 3 in 1 Base, Primer y Corrector Anthaway", 13.00,408.0, 11.00,VB,Active,2027-12-01,Maquillaje,Base de maquillaje,24
ST3352,Base Liquida 36h Vitamina C Fit me! Anthaway, 13.00,384.0, 11.00,VB,Active,2027-12-01,Maquillaje,Base de maquillaje,24
ST3350,Base Liquida 36h Hidratante Anthaway, 13.00,528.0, 11.00,VB,Active,2027-12-01,Maquillaje,Base de maquillaje,24
161-3020,Primer para rostro Kaliya Beauty Aloe 16H, 13.00,1287.0, 11.00,VB,Active,2028-08-01,Maquillaje,Primers de maquillaje,24
161-065,Primer para rostro Kaliya Beauty Vitamina C, 13.00,309.0, 11.00,VB,Active,2028-08-01,Maquillaje,Primers de maquillaje,24
161-095,Primer para rostro Kaliya Beauty Alta adherencia, 13.00,1128.0, 11.00,VB,Active,2028-08-01,Maquillaje,Primers de maquillaje,24
161-3024,Primer para rostro Kaliya Beauty Acabado húmedo definitivo, 13.00,1152.0, 11.00,VB,Active,2028-08-01,Maquillaje,Primers de maquillaje,24
8636P,Sombra de ojos Anylady Super Girl, 95.00,96.0, 80.00,VB,Active,2027-07-01,Maquillaje,Sombra,12
BX-330,Esponja para maquillar 3pcs Kiss Lovely, 15.00,409.0, 12.00,VB,Active,2029-01-01,Maquillaje,Esponjas de maquillaje,12
CS043,Esponja para maquillar 6pcs Envase Plastico, 19.00,635.0, 16.00,VB,Active,2029-01-01,Maquillaje,Esponjas de maquillaje,12
FP3137,Esponja para maquillar Sweet Beauty, 19.00,716.0, 16.00,VB,Active,2029-01-01,Maquillaje,Esponjas de maquillaje,12
B0021-RC,Body Spray Pink in Sweet 250ml, 80.00,24.0, 71.40,VB,Inactive,,Cuidado personal,Fragancias,12
0460,Primer Top Face Para Pieles Secas Rellena & Refresca, 13.00,696.0, 11.00,VB,Active,2027-07-01,Maquillaje,Primers de maquillaje,24
N221,Primer Top Face Rellena & Refresca, 13.00,648.0, 11.00,VB,Active,2025-12-01,Maquillaje,Primers de maquillaje,24
N220,Base Liquida Detoxificar Y Proteger Note, 13.00,408.0, 11.00,VB,Active,2027-06-01,Maquillaje,Base de maquillaje,24
0455,Base Liquida Skinwera Efecto Mate Larga Duracion Top Face, 13.00,408.0, 11.00,VB,Active,2026-01-01,Maquillaje,Base de maquillaje,24
CL814,Corrector Scanlon Alta Cobertura, 16.00,288.0, 13.00,VB,Active,2026-01-01,Maquillaje,Corrector,24
M23-157,Mascara De Pestañas Million Pauline Sube El Volumen, 19.00,24.0, 16.00,VB,Active,2026-10-01,Maquillaje,Mascara,24
DS335-2,Crema Depiladora Disaar 100g 5 Minutos, 42.00,24.0, 35.00,VB,Inactive,2028-07-01,Cuidado personal,Crema depiladora,12
DS335-1,Crema Depiladora Disaar 100g 3 Minutos, 42.00,24.0, 35.00,VB,Inactive,2028-07-01,Cuidado personal,Crema depiladora,12
DS5261,Tónico Facial Hidratante Disaar 200ml, 48.00,19.0, 40.00,VB,Active,2028-09-01,Maquillaje,Tonico facial,12
AC3142,Tonico Facial de Arroz Aichum Beauty Nutre Y Aclara 100ml, 42.00,47.0, 35.00,VB,Active,2028-07-01,Maquillaje,Tonico facial,12
AC3141,Contorno De Ojos Hidratante Y Aclarante De Arroz Aichun Beauty 25ml, 33.00,84.0, 28.00,VB,Active,2027-12-01,Maquillaje,Contorno de ojos,12
AC3120,Limpiador Facial Arroz Natural Aichum Beauty Nutre La Piel 100ml, 48.00,0.0, 40.00,VB,Inactive,2028-07-01,Maquillaje,Desmaquillante ó Limpiador facial,12
GJ7169,Set Skin Care Acido Kojic 5 Pcs, 283.00,3.0, 240.00,VB,Active,2028-06-01,Cuidado personal,Set skincare,6
161-014,Cosmetiquera #014, 53.00,0.0, 45.00,VB,Active,2029-01-01,Maquillaje,Cosmetiquera,12
994-02#,Sombra Anylady 15 tonos #2, 48.00,0.0, 40.00,VB,Inactive,2027-03-01,Maquillaje,Sombra,12
994-01#,Sombra Anylady 15 tonos #1, 48.00,12.0, 40.00,VB,Active,2027-06-01,Maquillaje,Sombra,12
S29-001,Brocha Para Maquillaje Set 7 Pzas Stay, 59.00,120.0, 50.00,Stay,Active,2029-01-01,Maquillaje,Brochas para maquillar,12
2324,Base Beauty City Matte Aprueba de agua, 62.00,0.0, 52.00,VB,Inactive,2026-10-01,Maquillaje,Base de maquillaje,24
2075,Base Beauty City BB cream, 62.00,95.0, 52.00,VB,Active,2027-10-01,Maquillaje,Base de maquillaje,24
161-015,Cosmetiquera #015, 53.00,129.0, 45.00,VB,Active,2029-01-01,Maquillaje,Cosmetiquera,12
5513,Lápiz Labial CHANLANYA Matte 5513, 15.00,624.0, 12.00,VB,Active,2027-01-01,Maquillaje,Labios,24
5360,Lápiz Labial CHANLANYA Matte 5360, 15.00,264.0, 12.00,VB,Active,2026-01-01,Maquillaje,Labios,24
5338,Lápiz Labial CHANLANYA Matte 5338, 15.00,456.0, 12.00,VB,Active,2026-01-01,Maquillaje,Labios,24
5323,Lápiz Labial Huda Beauty Matte 5323, 15.00,41.0, 12.00,VB,Active,2026-01-01,Maquillaje,Labios,24
30640,Esponja De Silicona Delicate, 18.00,336.0, 15.00,Mayz,Active,2029-01-01,Maquillaje,Esponjas de maquillaje,24
006-003493-2,Acondicionador Vinilady Liso Intenso, 99.00,76.0, 90.00,Mayz,Active,2025-03-01,Cuidado personal,Acondicionador capilar,12
006-003830-0,Crema Peinar Vinilady Aguacate (Super Boom) 300ml, 68.00,356.0, 57.00,Mayz,Active,2026-01-01,Cuidado personal,Crema capilar,24
006-003893-8,Champú Vinilady 325ml Vinilady Ondas Y Rizos, 68.00,0.0, 57.00,Mayz,Inactive,2026-01-01,Cuidado personal,Shampoo capilar,12
006-004092-4,Crema Peinar Vinilady Reparación Total 290, 68.00,293.0, 57.00,Mayz,Active,2025-10-01,Cuidado personal,Crema capilar,24
006-004086-0,Champú Vinilady 325ml Vinilady Reparación Total, 68.00,0.0, 57.00,Mayz,Inactive,2025-10-01,Cuidado personal,Shampoo capilar,12
006-004049-5,Champú Vinilady 325ml Vinilady Negro Absoluto, 68.00,2.0, 57.00,Mayz,Inactive,2026-01-01,Cuidado personal,Shampoo capilar,12
006-004027-4,Champú Vinilady 325ml Vinilady Liso Intenso, 68.00,0.0, 57.00,Mayz,Inactive,2026-01-01,Cuidado personal,Shampoo capilar,12
006-128713,Espuma P/Afeitar Majix 200ml Cool, 50.00,461.0, 42.00,Mayz,Active,2026-12-01,Cuidado personal,Espuma para afeitar,24
006-132581,Espuma para Afeitar Janti 200ml Sensitive, 40.00,165.0, 34.00,Mayz,Active,2026-11-01,Cuidado personal,Espuma para afeitar,24
006-C04,Shampoo Miya para Niños 12oz 2 En 1, 45.00,5231.0, 42.00,Mayz,Active,2025-03-01,Cuidado personal,Shampoo capilar,24
006-WKL258,Gel Para Ducha 550ml Lanolin Wokali, 70.00,20.0, 63.00,Mayz,Active,2025-03-01,Cuidado personal,Gel de ducha,6
006-WKL176,Gel Para Ducha 550ml Bamboo Wokali, 70.00,115.0, 63.00,Mayz,Active,2024-10-01,Cuidado personal,Gel de ducha,6
006-132574,Espuma P/Afeitar Janti 200ml regular, 40.00,212.0, 34.00,Mayz,Active,2026-11-01,Cuidado personal,Espuma para afeitar,24
1721N-B,Polvo Compacto Note Worthy 1721N-B, 29.00,660.0, 24.00,VB,Active,2027-12-01,Maquillaje,Polvo compacto,12
18-313,Esponja Para Cocina 5pcs 18-313, 16.00,142.0, 14.00,Stay,Active,2029-01-01,Maquillaje,Esponjas de maquillaje,5
2118N-A,Polvo compacto Note Worthy Glitter Story, 29.00,683.0, 24.00,VB,Active,2027-12-01,Maquillaje,Polvo compacto,12
2280-47,Fijador De Maquillaje Karité Aloe Vera Control de aceite y refrescante, 45.00,0.0, 38.00,VB,Inactive,2028-03-22,Maquillaje,Fijador de maquillaje,12
2368-47,Fijador De Maquillaje Kiss beauty Antioxidante & Control de grasa, 57.00,14.0, 48.00,VB,Inactive,,Maquillaje,Fijador de maquillaje,12
2377-47B,Limpiador Facial Karité 150ml Rosas, 71.00,336.0, 60.00,VB,Active,2028-06-01,Maquillaje,Desmaquillante ó Limpiador facial,12
2377-47C,Limpiador Facial Karité 150ml Vitamin E, 71.00,347.0, 60.00,VB,Active,2028-06-01,Maquillaje,Desmaquillante ó Limpiador facial,12
2377-47A,Limpiador Facial Karité 150ml Aloe, 71.00,276.0, 60.00,VB,Active,2028-06-01,Maquillaje,Desmaquillante ó Limpiador facial,12
35008-1,Lapiz Labial Mate Beauty Model Matte 35008-1, 13.00,42.0, 11.00,VB,Active,2027-09-01,Maquillaje,Labios,24
35002-1,Lapiz Labial Mate Beauty Model Matte 35002-1, 13.00,474.0, 11.00,VB,Active,2027-06-01,Maquillaje,Labios,24
56853-47,Mascara pestaña Karite 56853-47, 26.00,144.0, 22.00,VB,Active,2027-11-01,Maquillaje,Mascara,24
56939-03HA,Gel de cejas con Ácido Hialurónico, 22.00,384.0, 18.00,VB,Active,2028-04-01,Maquillaje,Mascara,24
68555-03,Primer Beauty Plump Prime, 57.00,156.0, 48.00,VB,Active,2028-06-01,Maquillaje,Primers de maquillaje,12
8166-01#,Sombra para Ojos Anylady Believe in yourselve, 65.00,12.0, 55.00,VB,Active,2027-03-05,Maquillaje,Sombra,12
8658FC,"Sombra para Ojos Sombra, Iluminador, Blush Anylady", 97.00,60.0, 76.86,BISUTERIA,Active,2028-04-01,Maquillaje,Sombra,12
8842E,Corrector Mate Ever Beauty 8842E, 22.00,71.0, 18.00,VB,Active,2028-07-01,Maquillaje,Corrector,36
8844E,Corrector Mate Ever Beauty 8844E, 22.00,431.0, 18.00,VB,Active,2028-06-01,Maquillaje,Corrector,36
8843E,Corrector Mate Ever Beauty 8843E, 22.00,648.0, 18.00,VB,Active,2028-07-01,Maquillaje,Corrector,24
9206N-L9,Polvo compacto Note Worthy Flash touch 9206N-L9, 28.00,960.0, 23.00,VB,Active,2026-01-01,Maquillaje,Polvo compacto,24
9301N-B,Polvo compacto Note Worthy Natural nude, 29.00,528.0, 24.00,VB,Active,2027-12-01,Maquillaje,Polvo compacto,12
A-3496,Polvo Compacto Mayeiline A-3496, 36.00,792.0, 30.00,VB,Active,2028-05-01,Maquillaje,Polvo compacto,12
A-3495,Polvo Compacto Mayeiline A-3495, 36.00,695.0, 30.00,VB,Active,2028-05-01,Maquillaje,Polvo compacto,12
B51,Primer Mac Skin Base Visage, 36.00,1284.0, 30.00,VB,Active,2027-04-01,Maquillaje,Primers de maquillaje,12
B7031,Lapiz Labial Mate Beauty Model 24hr, 13.00,96.0, 11.00,VB,Active,2027-05-01,Maquillaje,Labios,24
BOCR/009,Body 3 Pzas Pink in Sweet BOCR-009, 75.00,1.0, 63.00,VB,Inactive,,Cuidado personal,Fragancias,12
C009,Esponja para maquillar 6 Piezas Kiss Lovely C009, 23.00,0.0, 19.00,VB,Inactive,2029-01-01,Maquillaje,Esponjas de maquillaje,12
C008,Esponja para maquillar 6 Piezas Kiss Lovely C008, 23.00,240.0, 19.00,VB,Active,2029-01-01,Maquillaje,Esponjas de maquillaje,12
CL822,Corrector Liquido Scanlon CL822, 17.00,336.0, 14.00,VB,Active,2027-01-01,Maquillaje,Corrector,24
CL812,Base de Maquillaje Scanlon CL812, 48.00,12.0, 40.00,VB,Active,2026-01-01,Maquillaje,Base de maquillaje,12
ES6016,Sombra Favor Beauty Beach, 53.00,543.0, 45.00,VB,Active,2026-07-01,Maquillaje,Sombra,16
ES6107,Sombra Favor Beauty Kitty, 53.00,34.0, 45.00,VB,Active,2026-06-01,Maquillaje,Sombra,16
F004,Base Lorea SPF50+ Antioxidante, 20.00,3305.0, 16.00,VB,Active,2026-01-01,Maquillaje,Base de maquillaje,12
F003,Base Maybelline SPF50+ Alta cobertura, 25.00,2898.0, 16.00,VB,Active,2026-01-01,Maquillaje,Base de maquillaje,12
F007A,Primer CHANLANYA glitter, 38.00,168.0, 32.00,VB,Active,2026-01-01,Maquillaje,Primers de maquillaje,12
F007B,Primer CHANLANYA transparente, 38.00,192.0, 32.00,VB,Active,2026-01-01,Maquillaje,Primers de maquillaje,12
FP-375,Esponja Puff Sweet beauty FP-375, 38.00,2.0, 32.00,VB,Inactive,2029-01-01,Maquillaje,Esponjas de maquillaje,12
GJ7192,Tonico Facial de Acido Hialuronico 150ml GuanJing, 53.00,71.0, 45.00,VB,Active,2028-05-01,Maquillaje,Tonico facial,12
H64070 C,Base Huda Beauty Matte FPS 50+ todo tipo de pieles, 50.00,972.0, 42.00,VB,Active,2028-04-01,Maquillaje,Base de maquillaje,12
H98144-A,Lápiz Labial Huda Matte H98144-A, 15.00,3402.0, 12.00,VB,Active,2028-06-01,Maquillaje,Labios,24
H98149-24B,Lápiz Labial Huda Colores que duran todo el dia, 15.00,3624.0, 12.00,VB,Active,2028-04-01,Maquillaje,Labios,24
JM-570,Pestañas 1pcs Nooralazawi Nudes 3D, 12.00,40.0, 10.00,VB,Active,2026-01-01,Maquillaje,Articulos para pestañas,12
JM-603,Pestañas 1pcs Nooralazawi hechas a mano 5D, 12.00,208.0, 10.00,VB,Active,2026-01-01,Maquillaje,Articulos para pestañas,10
JM-599,Pestañas 1 pcs Nooralazawi hechas a mano 3D, 12.00,32.0, 10.00,VB,Active,2026-01-01,Maquillaje,Articulos para pestañas,10
L014,Primer Fit me! Alta duracion Love is beauty 24hr, 36.00,1229.0, 30.00,VB,Active,2026-01-01,Maquillaje,Primers de maquillaje,12
LC1161,Aceite Labial Magic LC1161, 13.00,2544.0, 11.00,VB,Active,2028-06-01,Maquillaje,Labios,24
LC1164,Aceite Labial Magic LC1164, 13.00,1072.0, 11.00,VB,Active,2028-07-01,Maquillaje,Labios,24
LC1197,Aceite Labial Magic LC1197, 13.00,288.0, 11.00,VB,Active,2028-07-01,Maquillaje,Labios,24
LC1201,Aceite Labial Magic LC1201, 13.00,1240.0, 11.00,VB,Active,2028-06-01,Maquillaje,Labios,30
LC1230,Balsamo Para Labios Magic LC1230, 13.00,1404.0, 11.00,VB,Active,2028-07-01,Maquillaje,Labios,12
LC1218,Aceite Labial Magic LC1218, 13.00,24.0, 11.00,VB,Active,2028-07-01,Maquillaje,Labios,24
LC1220,Aceite Labial Magic LC1220, 13.00,168.0, 11.00,VB,Active,2028-07-01,Maquillaje,Labios,24
LC1204,Aceite Labial Magic LC1204, 13.00,352.0, 11.00,VB,Active,2028-06-01,Maquillaje,Labios,24
LC1207,Brillo Para Labios Mate Magic Be sweet, 13.00,0.0, 11.00,VB,Inactive,2028-07-01,Maquillaje,Labios,24
LC1227,Brillo Para Labios Mate Magic color perfecto, 13.00,0.0, 11.00,VB,Inactive,2028-10-01,Maquillaje,Labios,24
LC1268,Brillo Para Labios Magic paleta corazón, 13.00,0.0, 11.00,VB,Inactive,2028-08-01,Maquillaje,Labios,24
LC929,Brillo para Labios Magic corazón love, 13.00,0.0, 11.00,VB,Inactive,2028-04-01,Maquillaje,Labios,24
LC618,Brillo De Labios Magic gatita, 13.00,0.0, 11.00,VB,Inactive,2028-05-01,Maquillaje,Labios,24
LO903,Polvo suelto banana Scanlon, 32.00,36.0, 27.00,VB,Active,2027-01-01,Maquillaje,Polvo compacto,12
LS112,Balsamo Para Labios Magic paleta espiral, 13.00,792.0, 11.00,VB,Active,2028-05-01,Maquillaje,Labios,24
M0045,Polvo Compacto Doble Million Pauline 24hr, 53.00,96.0, 45.00,VB,Active,2026-04-01,Maquillaje,Polvo compacto,12
M0010,Base Million Pauline Esencia de caracol SPF 25+, 45.00,132.0, 38.00,VB,Active,2025-09-01,Maquillaje,Base de maquillaje,12
LS115,Balsamo Para Labios Magic Taza gatito, 15.00,624.0, 12.00,VB,Active,2028-07-01,Maquillaje,Labios,24
LS116,Balsamo Para Labios Magic refresco, 15.00,2136.0, 12.00,VB,Active,2028-07-01,Maquillaje,Labios,24
M23-27,Polvo Compacto y corrector Million Pauline Mate, 53.00,0.0, 45.00,VB,Inactive,2027-04-01,Maquillaje,Polvo compacto,12
M22-51,Polvo Compacto Doble Million Pauline tono claro, 53.00,81.0, 45.00,VB,Active,2026-01-01,Maquillaje,Polvo compacto,12
M23-36,Mascara Million Pauline Refresca y revive, 29.00,1219.0, 24.00,VB,Active,2026-05-01,Maquillaje,Mascara,12
M22-81,Mascara Million Pauline Ma XXL, 29.00,1224.0, 24.00,VB,Active,2026-04-01,Maquillaje,Mascara,12
MB-023,Lapiz para cejas, 21.00,144.0, 18.00,VB,Inactive,2026-01-01,Maquillaje,Delineador,12
OLU973-3,Perfume niña candy sweet azul, 43.00,0.0, 36.00,VB,Inactive,,Cuidado personal,Perfumes,16
OLU988-1,Perfume niña science, 43.00,0.0, 36.00,VB,Inactive,,Cuidado personal,Perfumes,12
P004,Primer baby skin Maybelline borrador de poros, 18.00,3792.0, 14.00,VB,Active,2026-01-01,Maquillaje,Primers de maquillaje,24
P003,Primer base Mate Infalible Lorel, 18.00,3324.0, 14.00,VB,Active,2026-01-01,Maquillaje,Primers de maquillaje,12
DL-313,Shampoo Tinte Negro Dr Lana, 177.00,5.0, 150.00,VB,Inactive,,Cuidado personal,Shampoo capilar,12
RE-2004,Secadora De Cabello Remlngton 5000w, 271.00,10.0, 230.00,VB,Active,2029-01-26,Maquillaje,Secadora de cabello,6
RE-2038,Secadora De Cabello Reddenton 3000w, 306.00,15.0, 260.00,VB,Active,2029-01-26,Maquillaje,Secadora de cabello,3
RKQ-DM30,Serum Facial de Arroz Erha21 30ml, 30.00,3.0, 25.00,VB,Inactive,2026-06-01,Cuidado personal,Serum facial,24
RKQ-2609,Serum Facial de Colágeno Erha21 30ml, 30.00,399.0, 25.00,VB,Active,2026-06-01,Cuidado personal,Serum facial,24
KQ-6201,Serum Facial Vitamina C Erha21 30ml, 30.00,465.0, 25.00,VB,Active,2026-06-01,Cuidado personal,Serum facial,24
RX150X,Limpiador Facial 150ml Multi proposito, 53.00,181.0, 45.00,VB,Active,2026-05-01,Maquillaje,Desmaquillante ó Limpiador facial,12
KQ-VC150X,Limpiador Facial 150ml Vitamina C, 53.00,81.0, 45.00,VB,Active,2026-03-01,Maquillaje,Desmaquillante ó Limpiador facial,12
KQ-VE100,Serum Facial de Vitamina E 100ml, 48.00,142.0, 40.00,VB,Active,2026-03-01,Cuidado personal,Serum facial,12
KQ-BNS100,Serum Facial de Acido Hialuronico 100ml, 48.00,250.0, 40.00,VB,Active,2026-03-01,Cuidado personal,Serum facial,12
KQ-DM100,Serum Facial de Arroz 100ml, 48.00,179.0, 40.00,VB,Active,2026-06-01,Cuidado personal,Serum facial,12
S2-0064,Pala Plastica cuadrada Stay, 23.00,0.0, 19.00,Stay,Inactive,2029-01-26,Cuidado personal,Pala para pedicure,12
S2-0287,Perfiladora De Ceja 2 pzas Stay, 36.00,0.0, 32.00,Stay,Inactive,2029-01-26,Maquillaje,Perfiladoras,12
S2-0122,Espejo personal ovalado Stay, 37.00,0.0, 28.00,Stay,Inactive,2029-01-01,Maquillaje,Espejo,12
S2-0759,Set de esponjas para maquillar Stay, 25.00,24.0, 22.00,Stay,Active,2029-01-01,Maquillaje,Esponjas de maquillaje,12
S2-0737,Cepillo peinilla para Cabello Stay, 26.00,233.0, 22.00,Stay,Active,2029-01-01,Maquillaje,"Cepillo, peines y peinillas",12
S2-1035,Cepillo Para Cabello Stay Osito, 52.00,24.0, 44.00,Stay,Inactive,2029-01-26,Maquillaje,"Cepillo, peines y peinillas",12
S2-1276,Set para Ceja Set 3 Pzas, 36.00,0.0, 32.00,Stay,Inactive,2029-01-26,Cuidado personal,Tijera,12
S2-1371,Rizador de Pestaña Stay, 41.00,60.0, 36.00,Stay,Active,2029-01-01,Maquillaje,Encrespador,12
S21-021,Pincel Para Uñas, 14.00,22.0, 12.00,Stay,Active,2026-01-01,Maquillaje,Uñas,12
S29-1193,Esponja Facial Stay 6 piezas, 33.00,107.0, 29.00,Stay,Active,2029-01-01,Maquillaje,Esponjas de maquillaje,6
S37-0884,Pala para Pedicure Madera Stay, 24.00,0.0, 21.00,Stay,Inactive,2029-01-01,Cuidado personal,Pala para pedicure,12
S6-1363,Mascara Stay ultra volumen, 35.00,216.0, 31.00,Stay,Active,2025-12-01,Maquillaje,Mascara,24
S7-001,Mascara Stay transparente en gel, 33.00,360.0, 29.00,Stay,Active,2026-05-01,Maquillaje,Mascara,24
SD31936,Ampolla Facial con Vitamina C 7pcs x 2ml, 33.00,129.0, 28.00,VB,Active,2025-08-01,Cuidado personal,Serum facial,12
SD31943,Ampolla Facial 24K Gold 7pcs x 2ml, 33.00,113.0, 28.00,VB,Active,2025-11-01,Cuidado personal,Serum facial,12
SD30878,Ampolla Facial con Acido Hialuronico 7pcs x 2ml, 33.00,27.0, 28.00,VB,Active,2026-07-01,Cuidado personal,Serum facial,12
SE812,Sombra para ojos y contorno Scanlon, 33.00,207.0, 28.00,VB,Active,2027-01-01,Maquillaje,Sombra,12
SE872,Sombra Scanlon 35 tonos, 83.00,316.0, 70.00,VB,Active,2027-01-01,Maquillaje,Sombra,6
ST3312,Corrector Anthaway Alta definición, 12.00,1176.0, 10.00,VB,Active,2028-05-01,Maquillaje,Corrector,24
ST3315,Corrector Anthaway Babe Skin, 13.00,1992.0, 11.00,VB,Active,2028-05-01,Maquillaje,Corrector,24
ST3343,Base Anthaway Multiefecto, 13.00,456.0, 11.00,VB,Active,2027-03-01,Maquillaje,Base de maquillaje,24
ST3362,Base para maquillaje Super Stay, 13.00,336.0, 11.00,VB,Active,2027-12-01,Maquillaje,Base de maquillaje,24
ST3373,Corrector Anthaway 36 horas, 12.00,1991.0, 10.00,VB,Active,2028-03-01,Maquillaje,Corrector,24
ST3816A,Mascara Anthaway transparente azul, 10.00,2304.0, 8.00,VB,Active,2028-04-01,Maquillaje,Mascara,48
ST3817R,Mascara Anthaway transparente rosado, 10.00,3552.0, 8.00,VB,Active,2028-04-01,Maquillaje,Mascara,48
ST3828,Brillo Para Labios Anthaway azul, 10.00,1308.0, 8.00,VB,Active,2028-05-01,Maquillaje,Labios,12
ST3827,Brillo Para Labios Anthaway rosada, 10.00,1524.0, 8.00,VB,Active,2028-05-01,Maquillaje,Labios,12
V019,Body Spray amber romance 250ml, 71.00,33.0, 60.00,VB,Inactive,,Cuidado personal,Fragancias,18
WA-012,Rasuradora 3 Hojillas Wao azul!, 45.00,144.0, 40.00,Stay,Active,2029-01-01,Cuidado personal,Rasuradora,12
WA-223,Afeitadora 3 Hojillas morada, 38.00,250.0, 32.00,Stay,Active,2029-01-01,Cuidado personal,Rasuradora,12
Y3014,Primer Kaliya Beauty Vitamina C, 13.00,384.0, 11.00,VB,Active,2028-06-01,Maquillaje,Primers de maquillaje,24
Y3015,Primer Kaliya Beauty Unicor, 13.00,3136.0, 11.00,VB,Active,2028-06-01,Maquillaje,Primers de maquillaje,24
Z204,Primer Kaliya Beauty, 13.00,24.0, 11.00,VB,Active,2025-03-01,Maquillaje,Primers de maquillaje,24
F001,Base All Hours YvestSaintLaurent, 42.00,1132.0, 35.00,VB,Active,2026-01-01,Maquillaje,Base de maquillaje,12
M0281,Base Velvet Touch SPF+ 10 Million Pauline, 42.00,324.0, 35.00,VB,Active,2026-10-01,Maquillaje,Base de maquillaje,12
S6-1140A,Iluminador y bronceador Stay, 38.00,48.0, 33.00,Stay,Active,2025-07-01,Maquillaje,Iluminadores,24
T51037,Lápiz Labial Top Lady, 15.00,2112.0, 12.00,VB,Active,2028-06-01,Maquillaje,Labios,24
WHD-A03,Serum Facial de Aloe Vera 30ml, 31.00,62.0, 26.00,VB,Active,2025-09-01,Cuidado personal,Serum facial,12
161-003,Toallas Humedas 25pcs, 17.00,70.0, 14.00,VB,Active,2026-07-01,Cuidado personal,Toallas humedas,12
8171,Sombra AnyLady Only You, 42.00,1557.0, 35.00,VB,Active,2027-06-01,Maquillaje,Sombra,24
8138,Sombra AnyLady Little, 36.00,695.0, 30.00,VB,Active,2027-06-01,Maquillaje,Sombra,24
ST3351,Base Pro BB Cream Anthaway, 13.00,192.0, 11.00,VB,Active,2027-12-01,Maquillaje,Base de maquillaje,24
123,Bálsamo Para Labios Cute Fruit, 13.00,840.0, 11.00,VB,Active,2026-03-01,Maquillaje,Labios,24
161-009,Cosmetiquera, 59.00,0.0, 50.00,VB,Inactive,2029-01-01,Maquillaje,Cosmetiquera,12
161-008,Rizador De Pestaña Princess Art, 26.00,112.0, 22.00,VB,Active,2029-01-01,Maquillaje,Encrespador,12
H64026 C,Base Huda Beauty Fauxlens, 45.00,516.0, 38.00,VB,Active,2028-04-01,Maquillaje,Base de maquillaje,12
S6-1130,Delineador Liquido azul Stay, 29.00,141.0, 31.00,Stay,Active,2025-03-22,Maquillaje,Delineador,24
ST009,Primer L.A Girl Alta definición, 13.00,408.0, 11.00,VB,Active,2028-04-01,Maquillaje,Primers de maquillaje,24
WA-047,Sombra para ojos Wao!, 41.00,216.0, 36.00,Stay,Active,2026-05-01,Maquillaje,Sombra,24
974,Sombra AnyLady Dream Big, 48.00,84.0, 40.00,VB,Active,2027-05-01,Maquillaje,Sombra,12
8342,Balsamo + Exfoliante Labial, 33.00,1.0, 28.00,VB,Inactive,,Maquillaje,Labios,24
H7043,Iluminador con Glitter Huda Beauty, 26.00,2.0, 22.00,VB,Inactive,2028-10-01,Maquillaje,Iluminadores,24
F002,Base Loreal Paris Revital Fit, 36.00,837.0, 30.00,VB,Active,2026-01-01,Maquillaje,Base de maquillaje,12
6001,Protector Solar, 33.00,597.0, 28.00,VB,Active,2025-05-01,Cuidado personal,Protector Solar,12
BX3626,Piedra Jade, 33.00,1032.0, 28.00,VB,Active,2029-01-01,Maquillaje,Piedra Jade,12
BX-3503,Perfiladora De Ceja, 17.00,596.0, 14.00,VB,Active,2029-01-01,Maquillaje,Perfiladoras,12
M0273,Mascara de Pestañas 7D Million Pauline, 25.00,284.0, 21.00,VB,Active,2026-06-01,Maquillaje,Mascara,48
GJ7181,Limpiador Facial Retinol 100g, 50.00,65.0, 42.00,VB,Active,2026-05-01,Maquillaje,Desmaquillante ó Limpiador facial,12
JS-1228,Pegamento para Pestañas, 9.00,50.0, 7.00,VB,Active,2025-12-01,Maquillaje,Articulos para pestañas,12
DS51994,Contorno De Ojos 25ml, 42.00,336.0, 35.00,VB,Active,2028-06-01,Maquillaje,Contorno de ojos,24
BX3612,Set De Limpieza Facial, 77.00,101.0, 65.00,VB,Active,2029-01-01,Maquillaje,Esponjas de maquillaje,6
BX3535,Set De Maquillaje, 106.00,16.0, 90.00,VB,Active,2026-01-01,Maquillaje,Esponjas de maquillaje,4
8243,Mascara Para Pies, 36.00,24.0, 30.00,VB,Inactive,2025-12-01,Maquillaje,Mascara,12
SB802,Rubor Scalon, 71.00,167.0, 60.00,VB,Active,2028-01-01,Maquillaje,Blusher,12
M23-48,Mascara de Pestañas Sky High, 28.00,984.0, 23.00,VB,Active,2026-04-01,Maquillaje,Mascara,24
GJ7193,Serum Facial de Acido Hialuronico 40ml, 38.00,83.0, 32.00,VB,Active,2028-05-01,Cuidado personal,Serum facial,12
9603V,Polvo Compacto + Rubor Viktorisa Sempre, 38.00,0.0, 32.00,VB,Inactive,2027-12-01,Maquillaje,Polvo compacto,12
VS1712,Polvo Compacto y Bronceador Viktorisa Sempre, 38.00,720.0, 32.00,VB,Active,2026-01-01,Maquillaje,Polvo compacto,12
8294,Mascara de Pestañas 24H Sky High, 19.00,671.0, 16.00,VB,Active,2025-12-01,Maquillaje,Mascara,24
2188VS,Polvo Suelto Viktorisa Sempre, 30.00,912.0, 25.00,VB,Active,2026-12-01,Maquillaje,Polvo compacto,12
SZ-256,Brocha para maquillar 5 Pzas, 30.00,67.0, 25.00,VB,Active,2029-01-01,Maquillaje,Brochas para maquillar,12
M0195,Primer Million Pauline, 40.00,216.0, 34.00,VB,Active,2025-11-01,Maquillaje,Primers de maquillaje,12
9206N,Polvo Compacto Note Flash Touch 9206N, 22.00,816.0, 18.00,VB,Active,2026-01-01,Maquillaje,Polvo compacto,24
BX3600,Pegamento Para Uñas, 11.00,492.0, 9.00,VB,Active,2025-12-01,Maquillaje,Uñas,12
BX-414,Kit para Uñas 4 Pzs, 32.00,119.0, 27.00,VB,Active,2029-01-01,Maquillaje,Uñas,12
BX-842,Encrespadora de Pestaña, 22.00,848.0, 18.00,VB,Active,2029-01-01,Maquillaje,Encrespador,12
68603-47,Corrector Super BB, 22.00,360.0, 18.00,VB,Active,2028-05-01,Maquillaje,Corrector,24
LC1182,Aceite Labial + Tinte Para Labios, 22.00,0.0, 18.00,VB,Inactive,2028-06-01,Maquillaje,Labios,24
OLU909-6,Perfume Tubular Vercage, 22.00,96.0, 18.00,VB,Inactive,,Cuidado personal,Perfumes,24
OLU909-81,Perfume Tubular Swiss Army, 22.00,0.0, 18.00,VB,Inactive,,Cuidado personal,Perfumes,24
OLU909-112,Perfume Tubular Mome Blang, 22.00,117.0, 18.00,VB,Active,,Cuidado personal,Perfumes,24
OLU909-171,Perfume Tubular Invictus V, 22.00,24.0, 18.00,VB,Active,,Cuidado personal,Perfumes,24
OLU909-91,Perfume Tubular Invictus, 22.00,0.0, 18.00,VB,Inactive,,Cuidado personal,Perfumes,12
OLU909-50,Perfume Tubular Boos, 22.00,0.0, 18.00,VB,Inactive,,Cuidado personal,Perfumes,24
OLU909-31,Perfume Tubular Blue De Chenale, 22.00,48.0, 18.00,VB,Active,,Cuidado personal,Perfumes,24
OLU909-2,Perfume Tubular Billion Men, 22.00,0.0, 18.00,VB,Inactive,,Cuidado personal,Perfumes,24
OLU909-113,Perfume Tubular 212 Sexy Man, 22.00,0.0, 18.00,VB,Inactive,,Cuidado personal,Perfumes,24
JM-544,Pestañas Postizas 8mm, 24.00,240.0, 20.00,VB,Active,2026-01-01,Maquillaje,Articulos para pestañas,12
C013,Esponjas para maquillar Kiss Lovely C013, 24.00,12.0, 20.00,VB,Active,2029-01-01,Maquillaje,Esponjas de maquillaje,6
T345-24F,Pintura De Uña, 13.00,0.0, 11.00,VB,Inactive,2028-02-01,Maquillaje,Uñas,24
